ID;Listing Url;Scrape ID;Last Scraped;Name;Summary;Space;Description;Experiences Offered;Neighborhood Overview;Notes;Transit;Access;Interaction;House Rules;Thumbnail Url;Medium Url;Picture Url;XL Picture Url;Host ID;Host URL;Host Name;Host Since;Host Location;Host About;Host Response Time;Host Response Rate;Host Acceptance Rate;Host Thumbnail Url;Host Picture Url;Host Neighbourhood;Host Listings Count;Host Total Listings Count;Host Verifications;Street;Neighbourhood;Neighbourhood Cleansed;Neighbourhood Group Cleansed;City;State;Zipcode;Market;Smart Location;Country Code;Country;Latitude;Longitude;Property Type;Room Type;Accommodates;Bathrooms;Bedrooms;Beds;Bed Type;Amenities;Square Feet;Price;Weekly Price;Monthly Price;Security Deposit;Cleaning Fee;Guests Included;Extra People;Minimum Nights;Maximum Nights;Calendar Updated;Has Availability;Availability 30;Availability 60;Availability 90;Availability 365;Calendar last Scraped;Number of Reviews;First Review;Last Review;Review Scores Rating;Review Scores Accuracy;Review Scores Cleanliness;Review Scores Checkin;Review Scores Communication;Review Scores Location;Review Scores Value;License;Jurisdiction Names;Cancellation Policy;Calculated host listings count;Reviews per Month;Geolocation;Features
11210388;https://www.airbnb.com/rooms/11210388;20170306202425;2017-03-07;The Loft-Full Bath-Deck w/View;Loft in the Hill country 12-15 minutes directly west of downtown Austin.  It has a private deck that has a spectacular view of the surrounding hills. Equipped with Queen Bed, Refrigerator, microwave, TV w/Cable, Microwave, Wifi, A/C,Coffee Maker, etc;This loft has a spectacular view of the hills in the West Austin Area.  It is located 12 minutes from Austin City Limits Festival, 15 minutes from SXSW festival, and less then 20 minutes from Circuit of the Americas in East Austin.  The loft is equipped with Wifi as well as Cable TV.  The Bedroom has wooden floors and the bathroom is tiled.  The loft has cedar base boards, cedar crown molding, and the windows are also framed with cedar for a very western feel.  This is a perfect place for long term guests planning to be in town on business for a few months or more.;Loft in the Hill country 12-15 minutes directly west of downtown Austin.  It has a private deck that has a spectacular view of the surrounding hills. Equipped with Queen Bed, Refrigerator, microwave, TV w/Cable, Microwave, Wifi, A/C,Coffee Maker, etc This loft has a spectacular view of the hills in the West Austin Area.  It is located 12 minutes from Austin City Limits Festival, 15 minutes from SXSW festival, and less then 20 minutes from Circuit of the Americas in East Austin.  The loft is equipped with Wifi as well as Cable TV.  The Bedroom has wooden floors and the bathroom is tiled.  The loft has cedar base boards, cedar crown molding, and the windows are also framed with cedar for a very western feel.  This is a perfect place for long term guests planning to be in town on business for a few months or more. The loft is entirely private to the guest as is the Deck with the Hill Country view. My wife and I live on the property so we would be happy to do what we can to make your stay;none;This neighborhood is located in the hills west of downtown Austin with spectacular views both on the property as well as driving to it.  The property is blocks away from Lake Austin.;"The loft is located on a gated property.  There is a button on the gate to open from the outside.  Upon arrival I will provide a gate remote to avoid getting out of your vehicle during your stay.  Smoking is permitted on the outside Private Deck but not inside the loft.  We have a ""Superior"" rated water supply so drinking from the sink is safe.";There is no public transportation from this location, but by car you're less then 15 minutes to downtown Austin and less than 20 minutes to Circuit of the Americas in East Austin.;The loft is entirely private to the guest as is the Deck with the Hill Country view.;My wife and I live on the property so we would be happy to do what we can to make your stay more enjoyable.;The loft is entirely private but is adjacent to the house my wife and I live in.   We ask that you enjoy yourselves but being considerate with noise levels.  The house is also on a Septic System so we ask that feminine products not be flushed, but rather wrapped and placed in the waste basket.  Smoking is permitted on the outside Private Deck but not inside the loft.  No pets are allowed.  The loft comfortably accommodates 2 adults and a child so if you have a larger party then this location is not suitable for your needs.;https://a0.muscache.com/im/pictures/c351a9b5-5fcf-474d-9e0c-4cab24885d80.jpg?aki_policy=small;https://a0.muscache.com/im/pictures/c351a9b5-5fcf-474d-9e0c-4cab24885d80.jpg?aki_policy=medium;https://public.opendatasoft.com/api/v2/catalog/datasets/airbnb-listings/files/bace50215047ad508bbf0468d50fb1fe;https://a0.muscache.com/im/pictures/c351a9b5-5fcf-474d-9e0c-4cab24885d80.jpg?aki_policy=x_large;58386783;https://www.airbnb.com/users/show/58386783;John;2016-02-11;My father was USAF so I was born at Offutt AFB, Nebraska, but I grew up in Madrid, Spain most of my life because of my father being stationed at Torrejon AFB.  I came to Austin from Madrid in 1980 to attend college.  I also lived several years in Mexico.;"I am a High Tech Professional with over 30 years in the industry.  I've been working at Dell for 20 years.  My wife is a nurse in the healthcare industry.  We recently married in May of 2015.  Both of us grew up as dependents to a U.S. Air Force father and we both met and attended HIgh School at Torrejon Air Force Base outside of Madrid, Spain.  Both our mothers are from Madrid so we travel to Spain often to visit family and stay at our beach house in Alicante.  We both love boating on Lake Austin and love the beach too.  My wife lived on the beach in Ocean City, MD and moved to Austin after we married.

We look forward to having guests enjoy our Loft.  It's separate from the house so you will have total privacy.   My wife and I live in the adjacent house so if you need anything just let us know.";within an hour;100;;https://a0.muscache.com/im/pictures/c5c78f08-faef-401c-b133-6ea74ad8efbb.jpg?aki_policy=profile_small;https://a0.muscache.com/im/pictures/c5c78f08-faef-401c-b133-6ea74ad8efbb.jpg?aki_policy=profile_x_medium;;1;1;email,phone,reviews,kba;Canyon Edge Drive, Austin, TX 78733, United States;;78733;;Austin;TX;78733;Austin;Austin, TX;US;United States;30.337360935478735;-97.86327667821497;Loft;Entire home/apt;2;1.0;1;1;Real Bed;TV,Cable TV,Internet,Wireless Internet,Air conditioning,Pool,Free parking on premises,Heating,Family/kid friendly,Smoke detector,Carbon monoxide detector,Fire extinguisher,Essentials,Shampoo,Lock on bedroom door,24-hour check-in,Hangers,Hair dryer,Iron,Laptop friendly workspace,Self Check-In,Doorman Entry,Private entrance;;58;;;100;;1;0;2;1125;today;;10;34;64;281;2017-03-06;42;2016-03-13;2017-02-26;98;10;10;10;10;10;10;;;moderate;1;3.5;30.3373609355,-97.8632766782;Host Is Superhost,Host Has Profile Pic,Host Identity Verified,Is Location Exact
17471131;https://www.airbnb.com/rooms/17471131;20170407214050;2017-04-08;Claris I, Friendly Rentals;This apartment has: 1 double bed, 1 double sofa bed. Right next to Plaza Cataluña A spacious and bright one bedroom apartment in one of the best locations in Barcelona. Only steps away from Plaza Cataluña and Paseo de Gracia which allows you the benefit of culture, cuisine and fantastic shopping… all at your fingertips! The building has an elevator but there are eleven steps to climb first.;This apartment has: 1 double bed, 1 double sofa bed. Licence number: HUTB-006721    This lovely one bedroom apartment is very spacious and bright. Recently refurbished, the open plan living-dining-kitchen area is the perfect place to kick back and relax after a day of sightseeing. The wall of windows ensures that this area is flooded with light. The modern furnishings will make you feel right at home and the sofa converts into a double bed for the 3rd and 4th guests.  Any budding chef can try their hand at preparing some Spanish specialities in the fully fitted kitchen and you have the choice of sitting at the lovely glass dining table or more informally at the breakfast bar. The bedroom comes with a comfortable double bed and ample wardrobe space for your belongings. The en-suite bathroom has a shower unit and fresh linens and towels are provided for your stay. With wi-fi and AC/heating all included, this is the perfect apartment for a break in Barcelona at any time of year.;This apartment has: 1 double bed, 1 double sofa bed. Right next to Plaza Cataluña A spacious and bright one bedroom apartment in one of the best locations in Barcelona. Only steps away from Plaza Cataluña and Paseo de Gracia which allows you the benefit of culture, cuisine and fantastic shopping… all at your fingertips! The building has an elevator but there are eleven steps to climb first. This apartment has: 1 double bed, 1 double sofa bed. Licence number: HUTB-006721    This lovely one bedroom apartment is very spacious and bright. Recently refurbished, the open plan living-dining-kitchen area is the perfect place to kick back and relax after a day of sightseeing. The wall of windows ensures that this area is flooded with light. The modern furnishings will make you feel right at home and the sofa converts into a double bed for the 3rd and 4th guests.  Any budding chef can try their hand at preparing some Spanish specialities in the fully fitted kitchen and you have the choice of sit;none;Plaza   Cataluña Catalonia Square is the largest square in the centre with 30.000 meters square    it is the third biggest square in Spain. Some  of the most important streets and   Avenue interconnects with this important square, famous for its fountain, and   statues. Until almost half of  19th century the Plaça de Catalunya was mainly a   rural zone located outside the city walls. It was only in 1858 that the Madrid's   central government finally ordered the defensive walls to be torn down.,   approving also the construction outside the walls so a public contest was   organized in search of a  design of a new district. The first place was awarded   to a design by Rovira i Trias but the head government ended up choosing a far   more modern design with a grid plan by Ildefons Cerdà. Eventually the local and   head government agreed add a new plan. A design by the architect Puig i   Cadafalch (author of the  modernist building 'Casa de les Punxes') resulted in   the current enormous sq;;Ideal to discover the city either on foot or by public transport.;Travellers will have access to the entire apartment.;We will be more than happy to help you with anything you need. We can organize a transfer from the airport to the apartment.;CHECK-IN Week Days: The check-in and key collection takes place at: Friendly Rentals, Passatge Sert, 1-3 - Barcelona. Weekend and bank holidays: The check-in and key collection takes place at: Friendly Rentals, Carrer Ausias March, 27 - Barcelona. Please remember that check-in is between 15.00h and 02.00h. If you are arriving after 21.00h, there is a late check-in fee of 30 €.  Loud music and parties are strictly prohibited. Guests in a Friendly Rentals apartment should be aware that if loud music is played, or a party is held, and the neighbours complain and/or police are called, you may be immediately removed from the apartment regardless of the time, day or night. Noise regulations and respect for other residents between 22:00 and 10.00. We would appreciate your full cooperation in this matter and we hope you understand that these rules are necessary, as our apartments are located in residential buildings with people that have to get up early and go to work. The quiet time in the ev;https://a0.muscache.com/im/pictures/3ce27aee-f265-4049-82f8-d51bbd7f553d.jpg?aki_policy=small;https://a0.muscache.com/im/pictures/3ce27aee-f265-4049-82f8-d51bbd7f553d.jpg?aki_policy=medium;https://public.opendatasoft.com/api/v2/catalog/datasets/airbnb-listings/files/0d34787db9b94131f751dbf79ba77eed;https://a0.muscache.com/im/pictures/3ce27aee-f265-4049-82f8-d51bbd7f553d.jpg?aki_policy=x_large;102947901;https://www.airbnb.com/users/show/102947901;Claudia;2016-11-08;Barcelona, Catalonia, Spain;"Hola a todos! Soy Claudia Castillo y soy parte del equipo de Friendly Rentals. 
Somos un equipo joven y dinámico, y sobre todo con ganas de conocer gente nueva. Intentaremos que tu estancia con nosotros sea fantástica, porque como se dice, MI CASA ES TU CASA. 
Te esperamos!";within an hour;100;;https://a0.muscache.com/im/pictures/c071e13e-5719-4a57-af6e-489d46a29a5f.jpg?aki_policy=profile_small;https://a0.muscache.com/im/pictures/c071e13e-5719-4a57-af6e-489d46a29a5f.jpg?aki_policy=profile_x_medium;;162;162;email,phone,reviews,work_email;Barcelona, Barcelona 08010, Spain;;la Dreta de l'Eixample;Eixample;Barcelona;Barcelona;08010;Barcelona;Barcelona, Spain;ES;Spain;41.389682942216986;2.1726254301724186;Apartment;Entire home/apt;4;1.0;1;1;Real Bed;Wireless Internet,Air conditioning,Elevator in building,Heating,Washer,Hair dryer,Iron;;70;;;200;40;2;44;1;1125;today;;6;21;39;309;2017-04-08;1;2017-03-05;2017-03-05;80;8;10;10;10;8;10;HUTB-006721;;super_strict_30;106;0.86;41.3896829422,2.17262543017;Host Has Profile Pic,Requires License,Instant Bookable
17584891;https://www.airbnb.com/rooms/17584891;20170407214050;2017-04-08;Style Terrace Red, Friendly Rentals;This apartment has: 1 double bed, 1 double sofa bed. Excellent location and with terrace Ideally situated right between Paseo de Gracia and Rambla Cataluña, this apartment offers guests the luxury of fine dining, shopping and famous sights right on their doorstep.   All this and the added bonus of a private rooftop terrace - you can't ask for more.;This apartment has: 1 double bed, 1 double sofa bed. Licence number: HUTB-00752(URL HIDDEN) This lovely apartment is one of several we can offer in the building. The photographs are a selection of the various units. The apartments may vary slightly in the layout or décor but the features are the same. Your specific apartment will be allocated on arrival. This wonderful and sunny one bedroom apartment is the perfect choice for a romantic getaway for two or for a small family or group of friends.   The living area has been tastefully decorated in natural colors to ensure a bright and cheerful welcome. There is a comfortable sofa which converts into a double bed for the third and fourth guests and a dining table should you choose to eat at home.   The small but complete kitchen is modern and fully equipped with everything you might need for a relaxing holiday.   The bedroom, also decorated in natural colors, comes complete with a double bed and ample wardrobe space for all your belongings;This apartment has: 1 double bed, 1 double sofa bed. Excellent location and with terrace Ideally situated right between Paseo de Gracia and Rambla Cataluña, this apartment offers guests the luxury of fine dining, shopping and famous sights right on their doorstep.   All this and the added bonus of a private rooftop terrace - you can't ask for more. This apartment has: 1 double bed, 1 double sofa bed. Licence number: HUTB-00752(URL HIDDEN) This lovely apartment is one of several we can offer in the building. The photographs are a selection of the various units. The apartments may vary slightly in the layout or décor but the features are the same. Your specific apartment will be allocated on arrival. This wonderful and sunny one bedroom apartment is the perfect choice for a romantic getaway for two or for a small family or group of friends.   The living area has been tastefully decorated in natural colors to ensure a bright and cheerful welcome. There is a comfortable sofa which converts;none;Plaza   Cataluña Catalonia Square is the largest square in the centre with 30.000 meters square    it is the third biggest square in Spain. Some  of the most important streets and   Avenue interconnects with this important square, famous for its fountain, and   statues. Until almost half of  19th century the Plaça de Catalunya was mainly a   rural zone located outside the city walls. It was only in 1858 that the Madrid's   central government finally ordered the defensive walls to be torn down.,   approving also the construction outside the walls so a public contest was   organized in search of a  design of a new district. The first place was awarded   to a design by Rovira i Trias but the head government ended up choosing a far   more modern design with a grid plan by Ildefons Cerdà. Eventually the local and   head government agreed add a new plan. A design by the architect Puig i   Cadafalch (author of the  modernist building 'Casa de les Punxes') resulted in   the current enormous sq;;Ideal to discover the city either on foot or by public transport.;Travellers will have access to the entire apartment.;We will be more than happy to help you with anything you need. We can organize a transfer from the airport to the apartment.;CHECK-IN Week Days: The check-in and key collection takes place at: Friendly Rentals, Passatge Sert, 1-3 - Barcelona. Weekend and bank holidays: The check-in and key collection takes place at: Friendly Rentals, Carrer Ausias March, 27 - Barcelona. Please remember that check-in is between 15.00h and 02.00h. If you are arriving after 21.00h, there is a late check-in fee of 30 €.  Loud music and parties are strictly prohibited. Guests in a Friendly Rentals apartment should be aware that if loud music is played, or a party is held, and the neighbours complain and/or police are called, you may be immediately removed from the apartment regardless of the time, day or night. Noise regulations and respect for other residents between 22:00 and 10.00. We would appreciate your full cooperation in this matter and we hope you understand that these rules are necessary, as our apartments are located in residential buildings with people that have to get up early and go to work. The quiet time in the ev;https://a0.muscache.com/im/pictures/fd4528f3-f04e-4d6d-ae10-3cb06fb2321a.jpg?aki_policy=small;https://a0.muscache.com/im/pictures/fd4528f3-f04e-4d6d-ae10-3cb06fb2321a.jpg?aki_policy=medium;https://public.opendatasoft.com/api/v2/catalog/datasets/airbnb-listings/files/c4e12490992e0a0a820f161009d0fa4f;https://a0.muscache.com/im/pictures/fd4528f3-f04e-4d6d-ae10-3cb06fb2321a.jpg?aki_policy=x_large;102947901;https://www.airbnb.com/users/show/102947901;Claudia;2016-11-08;Barcelona, Catalonia, Spain;"Hola a todos! Soy Claudia Castillo y soy parte del equipo de Friendly Rentals. 
Somos un equipo joven y dinámico, y sobre todo con ganas de conocer gente nueva. Intentaremos que tu estancia con nosotros sea fantástica, porque como se dice, MI CASA ES TU CASA. 
Te esperamos!";within an hour;100;;https://a0.muscache.com/im/pictures/c071e13e-5719-4a57-af6e-489d46a29a5f.jpg?aki_policy=profile_small;https://a0.muscache.com/im/pictures/c071e13e-5719-4a57-af6e-489d46a29a5f.jpg?aki_policy=profile_x_medium;;162;162;email,phone,reviews,work_email;Barcelona, Barcelona 08008, Spain;;la Dreta de l'Eixample;Eixample;Barcelona;Barcelona;08008;Barcelona;Barcelona, Spain;ES;Spain;41.39303454891152;2.162173278684399;Apartment;Entire home/apt;4;1.0;1;1;Real Bed;Wireless Internet,Air conditioning,Elevator in building,Heating,Washer,Hair dryer,Iron;;70;;;200;60;2;42;1;1125;today;;7;21;42;291;2017-04-08;0;;;;;;;;;;HUTB-007527;;super_strict_30;106;;41.3930345489,2.16217327868;Host Has Profile Pic,Requires License,Instant Bookable
