1349311;https://www.airbnb.com/rooms/1349311;20170407214050;2017-04-08;Room & bathroom @ Sagrada Familia;FEBRUARY 6-10, entire apartment available - 2 double bedroom + 2 bathrooms. Spacious flat next to La Sagrada Familia with beautiful modernist tiled and hard wood floors, 2 bathrooms, high ceilings in a building with an elevator. We'll do everything to make you feel at home!;Our apartment has been recently renovated preserving the original modernist decoration from the turn of the 20th century such as tiled flooring combined with hard wood floors, doors, moldings and ceilings... The apartment is spacious (92m2) and has 2 bedrooms, 2 bathrooms, kitchen, office, and spacious living area with a charming balcony.  This house is quiet and comfortable as it has only 2 bedrooms. The apartment is shared with the hosts, that is us, Kris & Milena :). Your room is at the other end of the apartment and you have your own bathroom (not ensuite though, but you don't share it with us) so there is enough privacy for everyone.  Your room is interior, so no street noise whatsoever, although you can ocasionally hear a neighbour doing the dishes, flushing the toilet or  a baby cry (but no parties, our neighbours are mostly quiet). The room has a double bed, built-in closet, night table, TV + DvD and a big window. Sheets and towels are provided. Shared kitchen and living area.;FEBRUARY 6-10, entire apartment available - 2 double bedroom + 2 bathrooms. Spacious flat next to La Sagrada Familia with beautiful modernist tiled and hard wood floors, 2 bathrooms, high ceilings in a building with an elevator. We'll do everything to make you feel at home! Our apartment has been recently renovated preserving the original modernist decoration from the turn of the 20th century such as tiled flooring combined with hard wood floors, doors, moldings and ceilings... The apartment is spacious (92m2) and has 2 bedrooms, 2 bathrooms, kitchen, office, and spacious living area with a charming balcony.  This house is quiet and comfortable as it has only 2 bedrooms. The apartment is shared with the hosts, that is us, Kris & Milena :). Your room is at the other end of the apartment and you have your own bathroom (not ensuite though, but you don't share it with us) so there is enough privacy for everyone.  Your room is interior, so no street noise whatsoever, although you can ocasio;none;I love arriving home from work and suddenly seeing La Sagrada Familia in front of my eyes - it never seizes to amaze me. Our neighbourhood is a quiet residential neighbourhood with perfect location - supermarkets, markets and everything you might need is there, bars, restaurants, parks.  Gaudí's famous houses (Casa Mila La Pedrera, Casa Batllò), and emblematic Passeig de Gràcia and its shopping district are just 15min on foot.;;"For the walkers, the old town (""barrio Gótico) is 30min walking distance (towards the sea) and Gaudí's park Güell is also 30min away on foot, but uphill (away from the sea). There are supermarkets, pharmacies, opticians, banks, bars and restaurants on the same block and everywhere around. The flat is right between Verdaguer and Sagrada Familia metro stations, 5min walk from each, offering 3 different metro lines: L4, L5 and L2. L4 will take you directly to the Gothic heart of the city (3 stops) and to the beaches of Barcelona (Barceloneta, the most popular is 5 stops away). L5 will take you directly to Sants (main) train station (4 stops).  You can also take the tourist bus in front of Sagrada.";You will be given a set of keys upon your arrival. Apart from your room and bathroom you can also use the kitchen, living and dining room, balcony and laundrey. The kitchen has a Nespresso machine, oven, microwave, electric kettle, toaster and more, all of which are at your complete disposal.  Sheets and towels are provided.;"We like meeting our guests and hearing their stories, sharing our common space with them, and making them feel at home. If we go out we tend to invite our guests to join us, so they can meet more ""locals"". We also understand that our guests need space and time for themselves.";Smoking on the balcony.  No pets.  No parties.;https://a0.muscache.com/im/pictures/20892216/200b3068_original.jpg?aki_policy=small;https://a0.muscache.com/im/pictures/20892216/200b3068_original.jpg?aki_policy=medium;https://public.opendatasoft.com/api/v2/catalog/datasets/airbnb-listings/files/f435c1f5efb0fb889738f7f94a1dc8f7;https://a0.muscache.com/im/pictures/20892216/200b3068_original.jpg?aki_policy=x_large;2839207;https://www.airbnb.com/users/show/2839207;Milena & Kris;2012-07-05;Barcelona, Cataluña, Spain;"We are a Serbian-Canadian-Belgian couple in our 30s living and working in Barcelona. Kris was born in Palma de Mallorca, and then lived all over Belgium, Las Palmas de Gran Canaria, Paris, Madrid and now Barcelona. Milena was born in Serbia, raised in Toronto, and worked/studied in Granada, Madrid, Aubenas (France), Brussels and now Barcelona. How and why we ended up in Barcelona is a long story that we can tell you when we meet. :)

Living in Barcelona brings a lot of family and friends to our house, and we have done our best to welcome them, and we hope to welcome you as well.

We consider ourselves very easy-going and respectful hosts/guests. We believe that everyone needs privacy but it is very enriching to meet people and share experiences and ideas with them. We like meeting our guests and, if we are not working, we try to go out for a dinner or drink with them. 

We love travelling, discovering new places and learning about their people and culture. We both speak fluently English, French, Spanish and Serbian. Kris also speaks Dutch and Milena's constantly trying to add more languages to the repertoir :).";within an hour;100;;https://a0.muscache.com/im/users/2839207/profile_pic/1374158403/original.jpg?aki_policy=profile_small;https://a0.muscache.com/im/users/2839207/profile_pic/1374158403/original.jpg?aki_policy=profile_x_medium;La Sagrada Família;1;1;email,phone,facebook,reviews;La Sagrada Família, Barcelona, Catalonia 08025, Spain;La Sagrada Família;la Sagrada Família;Eixample;Barcelona;Catalonia;08025;Barcelona;Barcelona, Spain;ES;Spain;41.40235701867521;2.1711190801737055;Apartment;Private room;2;1.0;1;1;Real Bed;TV,Internet,Wireless Internet,Air conditioning,Kitchen,Smoking allowed,Elevator in building,Buzzer/wireless intercom,Heating,Family/kid friendly,Washer,First aid kit,Essentials,Shampoo,Hangers,Hair dryer,Iron;;45;;;300;30;1;20;3;7;yesterday;;13;38;66;66;2017-04-08;29;2013-07-25;2017-03-15;96;10;10;10;10;10;10;;;flexible;1;0.64;41.4023570187,2.17111908017;Host Has Profile Pic,Is Location Exact,Requires License
15698621;https://www.airbnb.com/rooms/15698621;20170407214050;2017-04-08;98. Enamorats;Unique apartment in vibrant neighborhoods, carefully selected by expert to make sure you like them as much as we do. A local concierge will welcome you and guide you during your entire stay to assist you in everything you may need.;"Fantastic apartment located 7 minutes from the Basilica of the Sagrada Familia. Fantastic apartment located 7 minutes from the Basilica of the Sagrada Familia. Located in a quiet street close to the busiest area of Barcelona. In our brand new apartment ""Enamorats"" find: 1 bedroom with double bed, 1 bedroom with twin beds, 1 large and bright living room where you can make a dinner and breakfast the Catalan style. In the spacious living area, you have a comfortable sofa bed for two people. Two comfortable bathrooms equipped with shower";"Unique apartment in vibrant neighborhoods, carefully selected by expert to make sure you like them as much as we do. A local concierge will welcome you and guide you during your entire stay to assist you in everything you may need. Fantastic apartment located 7 minutes from the Basilica of the Sagrada Familia. Fantastic apartment located 7 minutes from the Basilica of the Sagrada Familia. Located in a quiet street close to the busiest area of Barcelona. In our brand new apartment ""Enamorats"" find: 1 bedroom with double bed, 1 bedroom with twin beds, 1 large and bright living room where you can make a dinner and breakfast the Catalan style. In the spacious living area, you have a comfortable sofa bed for two people. Two comfortable bathrooms equipped with shower";none;;;;;;;https://a0.muscache.com/im/pictures/0451c4ab-10c6-4299-bd16-6c297bd9c10a.jpg?aki_policy=small;https://a0.muscache.com/im/pictures/0451c4ab-10c6-4299-bd16-6c297bd9c10a.jpg?aki_policy=medium;https://public.opendatasoft.com/api/v2/catalog/datasets/airbnb-listings/files/2b8f4d8ed584089229164abeae833d68;https://a0.muscache.com/im/pictures/0451c4ab-10c6-4299-bd16-6c297bd9c10a.jpg?aki_policy=x_large;54310958;https://www.airbnb.com/users/show/54310958;Javier;2016-01-12;Madrid, Community of Madrid, Spain;"Be Mate offers the exclusive City Mate service, a local concierge that will welcome you to the apartment and will assist you before, during and after your stay with everything you may need. From the variety of services you can choose from to live the perfect stay -tranfers, restaurant reservations, tickets for you favourite shows...-, your City Mate will be there for you, even filling up the fridge! You will love our professional and personal attention from the very beginning. You will have to worry only about enjoying your trip and to live the full Be Mate experience!

Be Mate, te recibe en sus apartamentos con un conserje local o ""City Mate"", que te dará la bienvenida y te guiará durante toda tu estancia para ayudarte en todo lo que puedas necesitar. Te ofrece una amplia variedad de servicios para una estancia perfecta, los traslados al aeropuerto o a cualquier otro punto de la ciudad, la reserva de un restaurante, sacará las entradas para tu espectáculo favorito o incluso llenará tu nevera vacía antes de llegar al apartamento. Desde el momento de tu llegada, te encantará nuestra atención personal y profesional. No tendrás que preocuparte de nada más que de disfrutar de tu viaje y de vivir por completo la ""Experiencia Be Mate"".";within an hour;99;;https://a0.muscache.com/im/pictures/8f3ec0f2-16eb-45bf-b714-aad8c7b8dd71.jpg?aki_policy=profile_small;https://a0.muscache.com/im/pictures/8f3ec0f2-16eb-45bf-b714-aad8c7b8dd71.jpg?aki_policy=profile_x_medium;L'Antiga Esquerra de l'Eixample;207;207;email,phone,reviews,jumio;El Camp de l'Arpa del Clot, Barcelona, Catalunya 08026, Spain;El Camp de l'Arpa del Clot;el Camp de l'Arpa del Clot;Sant Martí;Barcelona;Catalunya;08026;Barcelona;Barcelona, Spain;ES;Spain;41.4073563430039;2.1829815805463015;Apartment;Entire home/apt;6;2.0;2;3;Real Bed;TV,Wireless Internet,Air conditioning,Kitchen,Elevator in building,Heating,Washer,Essentials,Shampoo;;80;;;;;1;0;2;1125;a week ago;;0;0;2;2;2017-04-08;1;2017-01-08;2017-01-08;80;10;10;10;10;8;8;;;strict;92;0.33;41.407356343,2.18298158055;Host Has Profile Pic,Host Identity Verified,Is Location Exact,Requires License,Instant Bookable
6766647;https://www.airbnb.com/rooms/6766647;20170306202425;2017-03-07;5 Minutes to Downtown, Zilker!;Get everywhere in minutes! Charming, traditional home in the heart of old Austin. 2500 square foot home on a large 1/2 acre lot. Exceptionally convenient to ACL, SXSW, Formula One, and all that Austin has to offer.;Located on a large tree-covered lot less than two miles from downtown in one of Austin's oldest neighborhoods, our home is central to everything Austin has to offer. You will enjoy all the comforts of home in a setting evoking the elegance of the past. Tuck in to eat in the charming breakfast nook, enjoy your morning coffee or night-time refreshment on the large covered porch, doze in the hammock under the pecan trees, cuddle up with a book next to the beautifully carved limestone hearth in the living room, or watch movies in the den.  Upstairs, the home has a bathroom with a tub with shower. There also are three large bedrooms including a master with a king bed and two rooms with a queen and double bed respectively. If sharing a bed is not desirable, there is a queen sofa-bed in the den downstairs in addition to two extra twin mattresses. We will provide clean bed linens and towels. A blow dryer also is available for your use. Downstairs, there is a bathroom with a shower, the kitchen;Get everywhere in minutes! Charming, traditional home in the heart of old Austin. 2500 square foot home on a large 1/2 acre lot. Exceptionally convenient to ACL, SXSW, Formula One, and all that Austin has to offer. Located on a large tree-covered lot less than two miles from downtown in one of Austin's oldest neighborhoods, our home is central to everything Austin has to offer. You will enjoy all the comforts of home in a setting evoking the elegance of the past. Tuck in to eat in the charming breakfast nook, enjoy your morning coffee or night-time refreshment on the large covered porch, doze in the hammock under the pecan trees, cuddle up with a book next to the beautifully carved limestone hearth in the living room, or watch movies in the den.  Upstairs, the home has a bathroom with a tub with shower. There also are three large bedrooms including a master with a king bed and two rooms with a queen and double bed respectively. If sharing a bed is not desirable, there is a queen sofa-b;none;The Tarrytown neighborhood is best known for its elegant houses, churches, and quiet parks. It is one of Austin's most beautiful residential communities, near to downtown, Lake Austin, and University of Texas. Lake Austin, one of the main highlights of the Tarrytown neighborhood,  is ideal for boating, swimming, water-skiing, and picnics. On the southern edge of the neighborhood sits the Lions Municipal Golf Course which is another great attraction. On the north end of the neighborhood, the Laguna Gloria Museum and Mayfield Nature Preserve provide alternative entertainment options. The Mayfield Nature Preserve is a tranquil 22 acres of trails, creeks, flowers, and peacocks.;Our cat normally lives in the house. He will not be present for your stay.;"The location is exceptionally convenient, with easy access to Mopac, lakes, festivals, restaurants, shopping, parks, golf, bars, conventions, and shows; just minutes to anywhere in the city via car, city bus, bike, taxi, Fare, Fasten (like uber), and even your feet.  Located just 2 miles from downtown (SXSW, convention center) and UT, we are a 25-minute drive to the Formula 1 track.  Just 2 blocks away, there is a small neighborhood park and pool, with lovely shade trees and lots of play equipment. The pool is a relaxing place to spend a summer afternoon. The park marks the northern end of the Johnson Creek Trail, with direct access to the Butler Hike and Bike Trail, perfect for walking or biking to Lady Bird Lake and Zilker Park (ACL, Barton Springs). Also within a mile radius is the historic Deep Eddy Pool, touted as the oldest pool in Texas, fed with clear, cold spring water. During the summer months,  the pool sponsors Splash Party Movie Nights, showing family films on an inflatabl";Outdoor porch, hammock, Weber gas grill, large yard, parking in driveway.;Owners or their representative will be a phone call away and just around the corner if anything comes up.;1. Smoking is NOT allowed inside the residence. Your deposit will not be refunded if interior smoking has occurred during Tenant’s stay.  2. Check in time is at 3:00 pm CST and check out time is at 11:00 am CST. We have check-in/out times to give us enough time to clean and prepare the house for the next guest. If you need an earlier check-in or a later checkout time please call us and we will see if we can accommodate you.  3. We will provide you with a code to the house upon arrival.  4. There is a maximum occupancy rate of 8 persons. 5. The Property is NOT to be used for parties, weddings, special events, business marketing, or as a group gathering place during festivals.  6. Please keep the Property and all furnishings in good order as if they were your own. Only use appliances for their intended uses.  7. AT CHECK OUT  • Please turn off all lights (switches)  • Place used towels in the laundry room.  • You may leave the sheets, pillowcases and blankets on the beds.  • Please put u;https://a0.muscache.com/im/pictures/97530293/306065ec_original.jpg?aki_policy=small;https://a0.muscache.com/im/pictures/97530293/306065ec_original.jpg?aki_policy=medium;https://public.opendatasoft.com/api/v2/catalog/datasets/airbnb-listings/files/c5b21806a0217514204d784fc0e4d383;https://a0.muscache.com/im/pictures/97530293/306065ec_original.jpg?aki_policy=x_large;30713291;https://www.airbnb.com/users/show/30713291;Malia;2015-04-06;Austin, Texas, United States;"Malia is a native Austinite. She grew up in Tarrytown and spent many lazy afternoons at the lake, swimming at Barton Springs, and running along the hike and bike trails. Our home was built by her grandfather in the 1930s. Back then, it was on the outskirts of town, but now it's right in the middle of everything!

We are empty-nesters as of the Fall of 2016. Our oldest is a UT student, set to graduate in May.  Our youngest is a freshman in college.  Mike and Malia both are educators. Malia has taught Spanish for 27 years and loves to take students abroad each summer. Her favorite cities are Buenos Aires, Madrid, Barcelona, Santiago de Compostela, Sevilla, Granada, and Mexico DF.  Mike is originally from Ann Arbor, MI. Go Blue! He's a specialist in educational technology, with a particular interest in Physics and math, and  he is an avid hockey player here in Austin.

Our experience as Airbnb guests has been so much fun; we've met so many interesting people and through them have learned so much about the world. When we travel, we prefer home sharing to hiding away in a generic hotel room with little to no contact with others. As hosts we are a phone call away and we or our representative will be just around the corner.

We are really looking forward to being your hosts and sharing all our city has to offer!";within a few hours;100;;https://a0.muscache.com/im/users/30713291/profile_pic/1438745019/original.jpg?aki_policy=profile_small;https://a0.muscache.com/im/users/30713291/profile_pic/1438745019/original.jpg?aki_policy=profile_x_medium;West Austin;1;1;email,phone,reviews,kba;Enfield Road, Austin, TX 78703, United States;West Austin;78703;;Austin;TX;78703;Austin;Austin, TX;US;United States;30.287123948461037;-97.76816361292846;House;Entire home/apt;6;2.0;3;3;Real Bed;TV,Internet,Wireless Internet,Air conditioning,Kitchen,Free parking on premises,Indoor fireplace,Heating,Washer,Dryer,Smoke detector,Carbon monoxide detector,Fire extinguisher,Essentials,Shampoo,Hangers,Hair dryer,Iron,Laptop friendly workspace,translation missing: en.hosting_amenity_49,translation missing: en.hosting_amenity_50,Self Check-In,Lockbox,Private entrance;;795;;;;250;1;0;3;1125;today;;21;51;81;356;2017-03-06;1;2015-09-14;2015-09-14;100;10;10;10;10;10;10;;;strict;1;0.06;30.2871239485,-97.7681636129;Host Has Profile Pic,Host Identity Verified,Is Location Exact
13531067;https://www.airbnb.com/rooms/13531067;20170402075052;2017-04-02;AMSTERDAM, OUD-WEST;Cozy private room with a double bed in Oud-West, Amsterdam. Typical Dutch local neighborhood quiet but with live. All sorts of facilities: supermarkets, stores, cafés 1 min walking. Great location: 5min to the center, 7min Leidseplein (restaurants, bars, shops, etc.), the marvelous famous FoodHallen (restaurants), Waterkant (bar), Kade West (café).;;Cozy private room with a double bed in Oud-West, Amsterdam. Typical Dutch local neighborhood quiet but with live. All sorts of facilities: supermarkets, stores, cafés 1 min walking. Great location: 5min to the center, 7min Leidseplein (restaurants, bars, shops, etc.), the marvelous famous FoodHallen (restaurants), Waterkant (bar), Kade West (café).;none;;;;;;;https://a0.muscache.com/im/pictures/0cfd0182-b3b2-42cf-902f-24cb73a6c82e.jpg?aki_policy=small;https://a0.muscache.com/im/pictures/0cfd0182-b3b2-42cf-902f-24cb73a6c82e.jpg?aki_policy=medium;https://public.opendatasoft.com/api/v2/catalog/datasets/airbnb-listings/files/6351fdb41e5c30c168b2488e052d032f;https://a0.muscache.com/im/pictures/0cfd0182-b3b2-42cf-902f-24cb73a6c82e.jpg?aki_policy=x_large;36775877;https://www.airbnb.com/users/show/36775877;Raquel;2015-06-26;Madrid, Community of Madrid, Spain;Sociable, viajera y activa;within a day;100;;https://a0.muscache.com/im/users/36775877/profile_pic/1435316896/original.jpg?aki_policy=profile_small;https://a0.muscache.com/im/users/36775877/profile_pic/1435316896/original.jpg?aki_policy=profile_x_medium;;1;1;email,reviews;Amsterdam, North Holland, Netherlands;;De Baarsjes - Oud-West;;Amsterdam;North Holland;;Amsterdam;Amsterdam, Netherlands;NL;Netherlands;52.36667871194905;4.865594943841575;Apartment;Private room;2;1.0;1;1;Real Bed;TV,Wireless Internet,Heating,Family/kid friendly,Washer,Smoke detector,Essentials,Shampoo,Hangers,Hair dryer,Laptop friendly workspace;;100;;;;;1;0;2;1125;a week ago;;1;1;1;1;2017-04-02;6;2016-06-20;2016-10-23;87;9;8;9;10;10;8;;;moderate;1;0.63;52.3666787119,4.86559494384;Host Has Profile Pic
9474923;https://www.airbnb.com/rooms/9474923;20170512105218;2017-05-12;Sunny&cozy flat in residential area;My comfortable apartment is in a quiet neighbourhood on the new South, a trendy area in Antwerp. It's a 10 minute walk from the city centre, with easy access to public transport. Nice coffee bars, supermarkets, bakery, bank and restaurants nearby. Corner apartement with lots of natural light.;Bright living room with open view. Newly renovated. Comfortable and cozy. Authentic wooden floor. Modern and very spacious bathroom with shower and bathtub. Bedroom with big two person bed. Big windows allowing for a lot of natural light. Small but modern, fully equipped, 4 stove kitchen, oven and fridge.;My comfortable apartment is in a quiet neighbourhood on the new South, a trendy area in Antwerp. It's a 10 minute walk from the city centre, with easy access to public transport. Nice coffee bars, supermarkets, bakery, bank and restaurants nearby. Corner apartement with lots of natural light. Bright living room with open view. Newly renovated. Comfortable and cozy. Authentic wooden floor. Modern and very spacious bathroom with shower and bathtub. Bedroom with big two person bed. Big windows allowing for a lot of natural light. Small but modern, fully equipped, 4 stove kitchen, oven and fridge. Living room with sofa and dining table. Fully equipped kitchen. Comfortable bedroom with full size two persons bed. Bathroom with bathtub. No tv. With wifi. The new South 'Zuid' is a trendy area with wide streets and beautiful houses. It's a quiet area with cozy coffee bars, nice restaurants and several parks. Several metro, bus and tram stops on 5 minutes walking distance. The central train stat;none;The new South 'Zuid' is a trendy area with wide streets and beautiful houses. It's a quiet area with cozy coffee bars, nice restaurants and several parks.;;Several metro, bus and tram stops on 5 minutes walking distance. The central train station is a 15 minutes ride away by tram.;Living room with sofa and dining table. Fully equipped kitchen. Comfortable bedroom with full size two persons bed. Bathroom with bathtub. No tv. With wifi.;;Strictly no smoking. No pets. No noise after 22:00. Respectful and quiet guests please.;;;https://public.opendatasoft.com/api/v2/catalog/datasets/airbnb-listings/files/41e9e736519946f9329b30eb4f743056;;10690074;https://www.airbnb.com/users/show/10690074;Sofie;2013-12-18;Antwerp, Flanders, Belgium;I love travelling. It's my passion. City tripping, backpacking in Corsica, hiking the Andes, discovering lost cities in Colombia or Peru, gorilla watching in Uganda, shopping in Madrid, Bangkok and Stockholm. I studied in Barcelona for a year, and was working in Rome and Geneva. Currently, I'm working on projects in Africa, with frequent travel to Congo, Rwanda, Kenya, Senegal, and others. I love discovering local customs, music and food. I appreciate a good wine in good company, and a good book on a beautiful beach. My cosy appartement in the Quartier Latin in Antwerp is often empty due to my frequent trips. I hope to leave it to like-minded people when away, or swap flats for even more efficient travel :);;;;https://a0.muscache.com/im/users/10690074/profile_pic/1396548220/original.jpg?aki_policy=profile_small;https://a0.muscache.com/im/users/10690074/profile_pic/1396548220/original.jpg?aki_policy=profile_x_medium;;1;1;email,phone,reviews,jumio,work_email;Antwerpen, Vlaanderen 2018, Belgium;;Brederode;;Antwerpen;Vlaanderen;2018;Antwerp;Antwerpen, Belgium;BE;Belgium;51.204758731052614;4.4037291831801;Apartment;Entire home/apt;2;1.0;1;1;Real Bed;Wireless Internet,Kitchen,Hot tub,Heating,Washer,Dryer,Smoke detector,Carbon monoxide detector,Fire extinguisher,Essentials,Shampoo,24-hour check-in,Hangers,Hair dryer,Iron,Laptop friendly workspace,translation missing: en.hosting_amenity_49,translation missing: en.hosting_amenity_50;;64;;;;;1;0;60;1125;7 months ago;;0;3;33;308;2017-05-12;7;2016-01-05;2016-07-07;97;10;10;10;10;10;9;;;strict;1;0.43;51.2047587311,4.40372918318;Host Has Profile Pic,Host Identity Verified,Is Location Exact
