15458789;https://www.airbnb.com/rooms/15458789;20170407214050;2017-04-08;Paseo de Gracia E;Unique apartment in vibrant neighborhoods, carefully selected by expert to make sure you like them as much as we do. A local concierge will welcome you and guide you during your entire stay to assist you in everything you may need;Its high ceilings, wooden floors, large windows and a delightful luscious grey backdrop, exalt the relax sophistication of this two bedroom apartment. Yet the modern Paseo de Gracia Deluxe E is welcoming and cosy. Gracefully furnished, the living room area is fitted out with a large sofa, two chesterfield armchairs, a coffee table and for your entertainment there is a Flat Screen TV and Wi-Fi Service. An elegant dining table for six is next to the fully equipped kitchen, where you'll find everything you might need to prepare your meals: fridge, stove, oven, microwave, toaster, kettle and plenty of cabinets filled with crockery and utensils. The bedrooms are serene and cosy, one features two single beds and the master bedroom has a double bed. The bathroom boasts a relaxing bathtub, ideal after an adventurous day. While in Barcelona live like Barcelonians do. The spacious Paseo de Gracia Deluxe E two bedroom apartment is beautifully located in a residential area and can comfortably hous;Unique apartment in vibrant neighborhoods, carefully selected by expert to make sure you like them as much as we do. A local concierge will welcome you and guide you during your entire stay to assist you in everything you may need Its high ceilings, wooden floors, large windows and a delightful luscious grey backdrop, exalt the relax sophistication of this two bedroom apartment. Yet the modern Paseo de Gracia Deluxe E is welcoming and cosy. Gracefully furnished, the living room area is fitted out with a large sofa, two chesterfield armchairs, a coffee table and for your entertainment there is a Flat Screen TV and Wi-Fi Service. An elegant dining table for six is next to the fully equipped kitchen, where you'll find everything you might need to prepare your meals: fridge, stove, oven, microwave, toaster, kettle and plenty of cabinets filled with crockery and utensils. The bedrooms are serene and cosy, one features two single beds and the master bedroom has a double bed. The bathroom boa;none;;;;;;;https://a0.muscache.com/im/pictures/07b4eaf6-6837-40b2-adfc-1f8a2b9dc4a9.jpg?aki_policy=small;https://a0.muscache.com/im/pictures/07b4eaf6-6837-40b2-adfc-1f8a2b9dc4a9.jpg?aki_policy=medium;https://public.opendatasoft.com/api/v2/catalog/datasets/airbnb-listings/files/9d11b62a1282cca51ba879647062b583;https://a0.muscache.com/im/pictures/07b4eaf6-6837-40b2-adfc-1f8a2b9dc4a9.jpg?aki_policy=x_large;54310958;https://www.airbnb.com/users/show/54310958;Javier;2016-01-12;Madrid, Community of Madrid, Spain;"Be Mate offers the exclusive City Mate service, a local concierge that will welcome you to the apartment and will assist you before, during and after your stay with everything you may need. From the variety of services you can choose from to live the perfect stay -tranfers, restaurant reservations, tickets for you favourite shows...-, your City Mate will be there for you, even filling up the fridge! You will love our professional and personal attention from the very beginning. You will have to worry only about enjoying your trip and to live the full Be Mate experience!

Be Mate, te recibe en sus apartamentos con un conserje local o ""City Mate"", que te dará la bienvenida y te guiará durante toda tu estancia para ayudarte en todo lo que puedas necesitar. Te ofrece una amplia variedad de servicios para una estancia perfecta, los traslados al aeropuerto o a cualquier otro punto de la ciudad, la reserva de un restaurante, sacará las entradas para tu espectáculo favorito o incluso llenará tu nevera vacía antes de llegar al apartamento. Desde el momento de tu llegada, te encantará nuestra atención personal y profesional. No tendrás que preocuparte de nada más que de disfrutar de tu viaje y de vivir por completo la ""Experiencia Be Mate"".";within an hour;99;;https://a0.muscache.com/im/pictures/8f3ec0f2-16eb-45bf-b714-aad8c7b8dd71.jpg?aki_policy=profile_small;https://a0.muscache.com/im/pictures/8f3ec0f2-16eb-45bf-b714-aad8c7b8dd71.jpg?aki_policy=profile_x_medium;L'Antiga Esquerra de l'Eixample;207;207;email,phone,reviews,jumio;Dreta de l'Eixample, Barcelona, Catalunya 08009, Spain;Dreta de l'Eixample;la Dreta de l'Eixample;Eixample;Barcelona;Catalunya;08009;Barcelona;Barcelona, Spain;ES;Spain;41.39098987326012;2.1685873390693984;Apartment;Entire home/apt;4;1.0;2;3;Real Bed;TV,Wireless Internet,Air conditioning,Kitchen,Elevator in building,Heating,Washer,Essentials,Shampoo;;94;;;;;1;0;2;1125;a week ago;;0;0;0;0;2017-04-08;4;2016-10-31;2017-03-19;93;10;9;10;10;10;10;;;strict;92;0.75;41.3909898733,2.16858733907;Host Has Profile Pic,Host Identity Verified,Is Location Exact,Requires License,Instant Bookable
17115175;https://www.airbnb.com/rooms/17115175;20170407214050;2017-04-08;Flat close to Plaza España - Eixample;- Comfortable and clean double bedroom, with a big bed and wardrobe. - Private full equiped bathroom. - Large living room with working area, High Speed Wifi and TV with Netflix. - Fully equipped kitchen. - Breakfast included.;;- Comfortable and clean double bedroom, with a big bed and wardrobe. - Private full equiped bathroom. - Large living room with working area, High Speed Wifi and TV with Netflix. - Fully equipped kitchen. - Breakfast included. Blue underground line - 5 minutes walking Sants Estació Central Train Station - 15 minutes walking;none;;;Blue underground line - 5 minutes walking Sants Estació Central Train Station - 15 minutes walking;;;;https://a0.muscache.com/im/pictures/9611407d-167f-4b4d-8c52-6af8fa705e29.jpg?aki_policy=small;https://a0.muscache.com/im/pictures/9611407d-167f-4b4d-8c52-6af8fa705e29.jpg?aki_policy=medium;https://public.opendatasoft.com/api/v2/catalog/datasets/airbnb-listings/files/1be6d944c0e032df42793525d62d8aa5;https://a0.muscache.com/im/pictures/9611407d-167f-4b4d-8c52-6af8fa705e29.jpg?aki_policy=x_large;23996000;https://www.airbnb.com/users/show/23996000;Joan;2014-11-21;Madrid, Community of Madrid, Spain;;within an hour;100;;https://a0.muscache.com/im/pictures/e5635a7d-3952-4c64-a6c8-fe8a91bbf298.jpg?aki_policy=profile_small;https://a0.muscache.com/im/pictures/e5635a7d-3952-4c64-a6c8-fe8a91bbf298.jpg?aki_policy=profile_x_medium;L'Antiga Esquerra de l'Eixample;1;1;email,phone,reviews,jumio;L'Antiga Esquerra de l'Eixample, Barcelona, Catalunya 08029, Spain;L'Antiga Esquerra de l'Eixample;la Nova Esquerra de l'Eixample;Eixample;Barcelona;Catalunya;08029;Barcelona;Barcelona, Spain;ES;Spain;41.38600531434205;2.1433972223397064;Apartment;Private room;1;1.0;1;1;Real Bed;TV,Wireless Internet,Air conditioning,Kitchen,Breakfast,Elevator in building,Heating,First aid kit,Essentials,Shampoo,Hangers,Hair dryer,Iron,Laptop friendly workspace,translation missing: en.hosting_amenity_49,Private living room;;200;;;;;1;0;3;5;5 weeks ago;;11;39;69;70;2017-04-07;1;2017-03-02;2017-03-02;100;10;10;10;10;10;10;;;strict;1;0.79;41.3860053143,2.14339722234;Host Has Profile Pic,Host Identity Verified,Is Location Exact,Requires License
10378650;https://www.airbnb.com/rooms/10378650;20170407214050;2017-04-08;Sagrada famlia's Sunshine apartment;Bright and centric apartment just 50mts away from Sagrada familia's church. Perfect for couples or for up to 4 guests! 1 block away from metro and walking distance from all you need, supermarket, coffee shops, restaurants Kids & pets welcome!;"Lovely & Bright apartment, right next to Sagrada familia's church in Barcelona. Probably the best location in town!!! Centrally located, 100 meters from Metro station with a 15 minutes ride to ""Las Ramblas"" & the Gothic quarter, and 20 minutes to Park Güell and Barceloneta's beach.  It has all the amenities you need... accommodates up to 4 people comfortably on 1 double bed in the bedroom and 1 sofa-bed in the living room. Offered on a full apartment basis: accommodates up to 2 guests on the main bedroom + up to 2 extra guests on the living room/second private bedroom (Max. 4 guest total).";"Bright and centric apartment just 50mts away from Sagrada familia's church. Perfect for couples or for up to 4 guests! 1 block away from metro and walking distance from all you need, supermarket, coffee shops, restaurants Kids & pets welcome! Lovely & Bright apartment, right next to Sagrada familia's church in Barcelona. Probably the best location in town!!! Centrally located, 100 meters from Metro station with a 15 minutes ride to ""Las Ramblas"" & the Gothic quarter, and 20 minutes to Park Güell and Barceloneta's beach.  It has all the amenities you need... accommodates up to 4 people comfortably on 1 double bed in the bedroom and 1 sofa-bed in the living room. Offered on a full apartment basis: accommodates up to 2 guests on the main bedroom + up to 2 extra guests on the living room/second private bedroom (Max. 4 guest total). t has a fully equipped kitchen with an electric Induction stove, fridge, microwave and all the pans, pots and things you need if you like home cooking... or jus";none;"Located on a nice, clean, quiet and authentic Barcelona neighbourhood... Away enough from the touristy and loud center so you can sleep at night, but so close enough that you can enjoy it 'til late and get home any time on a 25 minute ""Nitbus"" (Night bus) ride.";Check in normally is at 15:30 and check out at 12:00 (noon) but in case you need something different let me know and I'll do my best to accommodate to your needs!;Metro is just a 100 meters away, connecting 2 lines the purple (Lila) L2  & Blue (Azul) L5... that takes you to any spot in the city in let than 30 min!  Also there is a bus stop just across the street that takes you to the beach and port olimpic area (bus V21) or to ciutadella park, Barceloneta area or gothic quarter (bus 19). It takes you about 35-45 minutes to get from the airport on public transport or a 20 minutes taxi ride.;"t has a fully equipped kitchen with an electric Induction stove, fridge, microwave and all the pans, pots and things you need if you like home cooking... or just preparing a ""bocadillo"" (snack/sandwich) for your long walks around town!  Also has a full toilet with a ""Half"" tub with shower, washing machine and a Balcony to enjoy the morning sunshine while having coffee! 10Mb broadband internet... but sorry no TV... but who needs one in barcelona with all those things happening around the city! (in case you miss your favourite TV series or a sunday evening movie...you will always have streaming options...) The price includes a cleaning fee to provide you with everything you need... Fresh sheets, duvet, towels, shampoo, shower gel, etc... Due to the space restrictions in the building the laundry is across the street from the apartment where there is a Self-service laundry with washing and drying machines. it opens 365 days a year from 9am until 10pm with great service and economical price";I'm a passionate traveller and have visited  I enjoy different cultures and love to learn from their people. I love music and art, I play the guitar and also love to party and hanging around with friends either on the beach or a nice park. So it's up to you how much do you wanna interact... but if you need any help getting around or have any troubles let me know... i'll always be happy to help!;I only expect you to treat my house as you will with yours... respect, be clean & enjoy! I really appreciate honesty, so if anything breaks or something gets damage, please be honest and let me know and we will find the best way to find a solution and Don't worry it's not Always about Money! When you arrive, you will find the place clean and tidy, so please leave it the same before you check out, take the  trash out, sweep and mop the floors and do your dishes. (you will find all the cleaning products under the sink).  Be considered about other fellow travellers that will come after you, otherwise an extra cleaning fee will come out of your deposit. If you need extra sheets or towels/beach towels you can rent them from me at your arrival. P.S. (last but not least...) - No smoking... that's part of the building rules so please not even on the balconies. - No partying (or after-partying) in the house... there are more bars in Barcelona than in whole Germany so please party in the right p;https://a0.muscache.com/im/pictures/f478e9ec-f1c4-484f-9f26-11d5c81daf00.jpg?aki_policy=small;https://a0.muscache.com/im/pictures/f478e9ec-f1c4-484f-9f26-11d5c81daf00.jpg?aki_policy=medium;https://public.opendatasoft.com/api/v2/catalog/datasets/airbnb-listings/files/004fd8e014c2be9a071e7eccea6a26fb;https://a0.muscache.com/im/pictures/f478e9ec-f1c4-484f-9f26-11d5c81daf00.jpg?aki_policy=x_large;695569;https://www.airbnb.com/users/show/695569;Nando;2011-06-13;Barcelona, Catalonia, Spain;Hi I'm Nando! I'm from Argentina ... but Been living / studying in Barcelona for 14 years now, I've Lived in Scotland a few years, another bit Madrid. just finished my third sociological degree and I'm manager of art gallery also I have my own little gallery in Barcelona.;within a few hours;100;;https://a0.muscache.com/im/pictures/7352f73c-53c0-44e4-8da0-fc12e1a2ae62.jpg?aki_policy=profile_small;https://a0.muscache.com/im/pictures/7352f73c-53c0-44e4-8da0-fc12e1a2ae62.jpg?aki_policy=profile_x_medium;La Sagrada Família;1;1;email,phone,facebook,reviews,jumio;La Sagrada Família, Barcelona, Catalunya 08025, Spain;La Sagrada Família;la Sagrada Família;Eixample;Barcelona;Catalunya;08025;Barcelona;Barcelona, Spain;ES;Spain;41.408073471589645;2.172669055152655;Apartment;Entire home/apt;4;1.0;2;2;Real Bed;Internet,Wireless Internet,Kitchen,Heating,Family/kid friendly,Smoke detector,First aid kit,Safety card,Essentials,Shampoo,24-hour check-in,Hangers,Hair dryer,Laptop friendly workspace;;65;;;150;20;1;15;1;1125;today;;3;6;9;63;2017-04-08;50;2016-02-21;2017-04-01;93;9;9;10;10;10;9;;;strict;1;3.63;41.4080734716,2.17266905515;Host Has Profile Pic,Host Identity Verified,Is Location Exact,Requires License
12069765;https://www.airbnb.com/rooms/12069765;20170407214050;2017-04-08;Habitación doble confortable;;Durante tu estancia convivirás con una pareja jovenes, artistas y una gata.  En un sencillo pero acogedor apartamento, situado en el barrio de Badal. Recién amueblado, dispone: de tres habitaciones, dos dobles y una individual, salón-comedor, cuarto de baño, cocina y lavadero. Además de todo lo necesario para que puedas sentirte cómodo y disfrutar de tu estancia en Barcelona. Bien comunicado, cerca comercios, centro de salud y gimnasio.;"Durante tu estancia convivirás con una pareja jovenes, artistas y una gata.  En un sencillo pero acogedor apartamento, situado en el barrio de Badal. Recién amueblado, dispone: de tres habitaciones, dos dobles y una individual, salón-comedor, cuarto de baño, cocina y lavadero. Además de todo lo necesario para que puedas sentirte cómodo y disfrutar de tu estancia en Barcelona. Bien comunicado, cerca comercios, centro de salud y gimnasio. Podrás acceder a las zonas comunes: salón-comedor, cocina, cuarto de baño y lavadero. Podrás disfrutar de los diferentes espacios como un miembro más del hogar. Estoy todo el día fuera por trabajo y estudios aunque contactable para poderte ayudar en lo que puedas necesitar durante tu estancia en casa. Sants-Badal es uno de los barrios que componen el distrito de Sants-Montjuïc, en el sur de Barcelona. Linda, al noroeste, con la Avinguda de Madrid; al este, con la Ronda del Mig; y, al suroeste, con el municipio de L’Hospitalet de Llobregat. Por su interi";none;"Sants-Badal es uno de los barrios que componen el distrito de Sants-Montjuïc, en el sur de Barcelona. Linda, al noroeste, con la Avinguda de Madrid; al este, con la Ronda del Mig; y, al suroeste, con el municipio de L’Hospitalet de Llobregat. Por su interior discurre la Carretera de Sants. El barrio, aunque independiente, mantiene sus vínculos con los barrios colindantes, especialmente el barrio de Sants. Hay una buena comunicación de autobuses y de metro (Badal). Con una de las calles más largas de comercios de Barcelona, Carretera de Sants. Cerca del Camp Nou, a 10 min de la Zona Universitaria y a 20 min de la montaña de Montjuïc.";;Parada de metro más cercana L5 Badal.;Podrás acceder a las zonas comunes: salón-comedor, cocina, cuarto de baño y lavadero. Podrás disfrutar de los diferentes espacios como un miembro más del hogar.;Estoy todo el día fuera por trabajo y estudios aunque contactable para poderte ayudar en lo que puedas necesitar durante tu estancia en casa.;Deberán respetar las horas de descanso de 22:00 - 8:00h. Horario de lavadoras de: 8:00h - 20:00h Colaborar con el mantenimiento de la limpieza del hogar.;https://a0.muscache.com/im/pictures/69d61a29-ddb3-4ef7-af72-be66e09cd9ac.jpg?aki_policy=small;https://a0.muscache.com/im/pictures/69d61a29-ddb3-4ef7-af72-be66e09cd9ac.jpg?aki_policy=medium;https://public.opendatasoft.com/api/v2/catalog/datasets/airbnb-listings/files/ec1407d553fc45e58a9550355b86a48a;https://a0.muscache.com/im/pictures/69d61a29-ddb3-4ef7-af72-be66e09cd9ac.jpg?aki_policy=x_large;61358350;https://www.airbnb.com/users/show/61358350;Sara;2016-03-03;Barcelona, Catalonia, Spain;Artista trabajadora, estudiante de Bellas Artes, viajera, amiga de la vida, de la naturaleza, de los corazones generosos y de la sencillez.;within a few hours;100;;https://a0.muscache.com/im/pictures/ce7206aa-4e12-4f46-a348-e68f74fece33.jpg?aki_policy=profile_small;https://a0.muscache.com/im/pictures/ce7206aa-4e12-4f46-a348-e68f74fece33.jpg?aki_policy=profile_x_medium;Sants-Montjuïc;1;1;email,phone,reviews;Sants-Montjuïc, Barcelona, Catalunya 08028, Spain;Sants-Montjuïc;Sants - Badal;Sants-Montjuïc;Barcelona;Catalunya;08028;Barcelona;Barcelona, Spain;ES;Spain;41.372830808114884;2.1277256583925213;Condominium;Private room;2;1.0;1;1;Real Bed;Wireless Internet,Kitchen,Breakfast,Pets live on this property,Cat(s),Washer,Essentials,Shampoo,Hangers,Hair dryer,Iron,Laptop friendly workspace,translation missing: en.hosting_amenity_49,translation missing: en.hosting_amenity_50;;24;;;;5;16;10;1;1125;a week ago;;5;5;5;132;2017-04-07;5;2016-07-11;2016-08-05;96;10;10;10;10;10;10;;;flexible;1;0.55;41.3728308081,2.12772565839;Host Has Profile Pic,Is Location Exact,Requires License
5266080;https://www.airbnb.com/rooms/5266080;20170407214050;2017-04-08;Habitación doble muy tranquila en centro Barcelona;Habitación de matrimonio, estupendamente ubicada, tranquila y bien comunicada por transporte público.   Cerca de lugares de interés, playa, centro, Borne, Encants,  parque, zoo, Sagrada Familia...etc. Próxima a estaciones de tren, bus, metro, tranvía.;Es tranquilo y bien situado,  al estar orientado a interior de manzana, es luminoso y silencioso y pueden alojarse sin problema tres personas  (habitación doble + habitación individual).;Habitación de matrimonio, estupendamente ubicada, tranquila y bien comunicada por transporte público.   Cerca de lugares de interés, playa, centro, Borne, Encants,  parque, zoo, Sagrada Familia...etc. Próxima a estaciones de tren, bus, metro, tranvía. Es tranquilo y bien situado,  al estar orientado a interior de manzana, es luminoso y silencioso y pueden alojarse sin problema tres personas  (habitación doble + habitación individual). No tengo inconveniente en compartir con ellos las zonas comunes, comedor, baños.. y cocina si lo necesitan. Suelo relacionarme con mis huéspedes todo lo que el idioma me permite y acostumbro a estar durante su estancia por si necesitan algo. Mi barrio me encanta, porque no es bullicioso a pesar de estar cerca del centro, Born, Sagrada Familia, Forum, parque de la Ciutadella, Auditorium, Teatro Nacional, Zoo, mercado Encants... y sobre todo la playa, puedes coger la toalla y bajar a tomar el sol dando un paseo de 10 minutos. La zona está muy bien comunicad;none;Mi barrio me encanta, porque no es bullicioso a pesar de estar cerca del centro, Born, Sagrada Familia, Forum, parque de la Ciutadella, Auditorium, Teatro Nacional, Zoo, mercado Encants... y sobre todo la playa, puedes coger la toalla y bajar a tomar el sol dando un paseo de 10 minutos.;;La zona está muy bien comunicada por transporte público, tren, bus, tranvía, metro.. además con un poco de paciencia incluso se puede encontrar aparcamiento gratuito muy cerca. Desde el aeropuerto se puede llegar además de en taxi, con autobús y metro.;No tengo inconveniente en compartir con ellos las zonas comunes, comedor, baños.. y cocina si lo necesitan.;Suelo relacionarme con mis huéspedes todo lo que el idioma me permite y acostumbro a estar durante su estancia por si necesitan algo.;El comportamiento que espero de mis huéspedes es de corrección e higiene normales, pero con confianza y libertad de solicitar lo que necesiten. No me importaría aceptar mascotas, si están convenientemente educadas. En cuanto al tabaco, no tengo problema en que se fume en la terraza o el patio, o incluso en el comedor, siempre que estén las puertas abiertas y no moleste al resto de inquilinos.;;;https://public.opendatasoft.com/api/v2/catalog/datasets/airbnb-listings/files/ca20ae2081627441f691e3b6911298d2;;27256558;https://www.airbnb.com/users/show/27256558;María Dolores;2015-02-05;Barcelona, Catalonia, Spain;"Procedo de Madrid, pero llevo dos tercios de mi vida en Catalunya que me encanta!

Aquí formé mi familia y nacieron mi hijos y mis 2 preciosas nietas.

Tengo muy buenos amigos con los que me encanta compartir mis aficiones, cine, música, viajes, naturaleza, cocina....

Ahora que mi familia es independiente, tengo espacio en casa y recibir huéspedes, me ayuda económicamente y me enriquece personalmente.

Es una agradable experiencia!";within a few hours;100;;https://a0.muscache.com/im/pictures/897cf59d-295c-4851-ac26-aa50f1d473d8.jpg?aki_policy=profile_small;https://a0.muscache.com/im/pictures/897cf59d-295c-4851-ac26-aa50f1d473d8.jpg?aki_policy=profile_x_medium;Glòries - El Parc;2;2;email,phone,facebook,reviews;Glòries - El Parc, Barcelona, Catalunya 08018, Spain;Glòries - El Parc;el Parc i la Llacuna del Poblenou;Sant Martí;Barcelona;Catalunya;08018;Barcelona;Barcelona, Spain;ES;Spain;41.39471080649023;2.1875425125966257;Apartment;Private room;2;2.0;1;1;Real Bed;TV,Cable TV,Internet,Wireless Internet,Air conditioning,Wheelchair accessible,Pets allowed,Doorman,Breakfast,Elevator in building,Buzzer/wireless intercom,Heating,Family/kid friendly,First aid kit,Essentials,Hangers,Hair dryer,Iron;;40;;;;5;1;15;1;1125;2 days ago;;30;60;90;365;2017-04-07;0;;;;;;;;;;;;flexible;2;;41.3947108065,2.1875425126;Host Has Profile Pic,Is Location Exact,Requires License
