4736808;https://www.airbnb.com/rooms/4736808;20170407214050;2017-04-08;Loft en el corazón del Born !;Piso en el corazon del Born a 5m de Santa Maria del Mar ,del Parque de la Ciudatella y a10m de Las Ramblas y el mar. A 10 m de Plaza Caraluña y Passeig de Gracia. Situado en la zona mas trendy de Barcelona, el piso da a la calle Carders, rodeado de restaurantes, supermercados y vida nocturna !;Loft muy bien cuidado con todo lo necesario para pasar unos días en Barcelona. Un lugar donde podrás descansar y vivir el Barcelona autentico. Con una cama doble en la parte habitación y un sofá-cama en salón, puede recibir a 4 personas, dispone de una cocina americana equipada y un baño moderno. Perfecto para amigos, parejas, familias…;Piso en el corazon del Born a 5m de Santa Maria del Mar ,del Parque de la Ciudatella y a10m de Las Ramblas y el mar. A 10 m de Plaza Caraluña y Passeig de Gracia. Situado en la zona mas trendy de Barcelona, el piso da a la calle Carders, rodeado de restaurantes, supermercados y vida nocturna ! Loft muy bien cuidado con todo lo necesario para pasar unos días en Barcelona. Un lugar donde podrás descansar y vivir el Barcelona autentico. Con una cama doble en la parte habitación y un sofá-cama en salón, puede recibir a 4 personas, dispone de una cocina americana equipada y un baño moderno. Perfecto para amigos, parejas, familias… Aire acondicionado. Ropa de cama y toallas incluidas. Los huéspedes tendrán acceso a toda la propiedad. Estaré encantada poder ayudar a los huéspedes si necesitan información sobre mi apartamento o la ciudad. No duden en contactar conmigo. :) El Borne, el corazón de la ciudad, la mejor zona con sus calles, sus restaurantes y bares, su cultura, su tiendas... Un bar;none;El Borne, el corazón de la ciudad, la mejor zona con sus calles, sus restaurantes y bares, su cultura, su tiendas... Un barrio donde podrás disfrutar. La playa está muy cerca!;"Si vas a llegar por la noche después de las 21:00 por favor fíjate en las normas de la casa para que coordinemos ;)";Estaciones de metro, autobús a 2m. Estaciones principales de tren Plaza Cataluña y Estació de Franca  y Arc de Triunfo a 10m;Aire acondicionado. Ropa de cama y toallas incluidas. Los huéspedes tendrán acceso a toda la propiedad.;Estaré encantada poder ayudar a los huéspedes si necesitan información sobre mi apartamento o la ciudad. No duden en contactar conmigo. :);"HORARIO DE LLEGADA:  - De 16h a 20h = GARANTIZADO - Llegada entre las 21:00 y las 23:00 tendrá un extra de 30€. Después de las 23:00 consultar disponibilidad. CHECKIN TIME:  - From 4 to 8 PM = Guaranteed  - Late check-ins between 21:00 and 23;00 extra fee 30€. After 23:00 please ask me to check availability.  - No se puede fumar dentro. Está completamente prohibido. / No smoking - Está prohibido ingresar a personas no autorizadas . Solo huéspedes. / Only guest are authorized to enter the flat.";https://a0.muscache.com/im/pictures/e42640b2-e570-493d-bc7b-19ec0fc8d6df.jpg?aki_policy=small;https://a0.muscache.com/im/pictures/e42640b2-e570-493d-bc7b-19ec0fc8d6df.jpg?aki_policy=medium;https://public.opendatasoft.com/api/v2/catalog/datasets/airbnb-listings/files/c7a36d1ae7c95d61cce68a855b80efdc;https://a0.muscache.com/im/pictures/e42640b2-e570-493d-bc7b-19ec0fc8d6df.jpg?aki_policy=x_large;13810104;https://www.airbnb.com/users/show/13810104;Monica;2014-04-02;Madrid, Community of Madrid, Spain;Hola,soy Monica y trabajo en el mundo de la moda y el diseño. Soy aficionada a la música y el arte en general! Cocinera macrobiótica,vegana y raw ,tengo un estilo de vida muy (URL HIDDEN) encanta vivir y disfrutar de las ventajas que ofrecen vivir en el centro de ciudades como Madrid o Barcelona,cuando necesito desconectar voy a la paz que me ofrece Cadaques! Practico yoga para calmar el alma y el l espíritu!!;within an hour;100;;https://a0.muscache.com/im/pictures/855e82f4-543f-4bba-8056-cace3883363d.jpg?aki_policy=profile_small;https://a0.muscache.com/im/pictures/855e82f4-543f-4bba-8056-cace3883363d.jpg?aki_policy=profile_x_medium;;6;6;email,phone,reviews;Barcelona, CT 08003, Spain;;Sant Pere, Santa Caterina i la Ribera;Ciutat Vella;Barcelona;CT;08003;Barcelona;Barcelona, Spain;ES;Spain;41.387771215478274;2.179003365441999;Apartment;Entire home/apt;4;1.0;1;2;Real Bed;TV,Internet,Wireless Internet,Air conditioning,Kitchen,Elevator in building,Family/kid friendly,Washer,Dryer,First aid kit,Essentials,Shampoo,Hangers,Hair dryer,Iron,Laptop friendly workspace;;100;;;150;25;1;20;4;1125;today;;22;46;71;346;2017-04-08;27;2016-06-05;2016-10-25;89;10;9;10;9;10;9;;;flexible;1;2.63;41.3877712155,2.17900336544;Host Has Profile Pic,Requires License,Instant Bookable
2538360;https://www.airbnb.com/rooms/2538360;20170407214050;2017-04-08;Cozy 2 bedroom apartment in Sants;Our cool two bedroom apartment has a true local feeling. Placed right in the middle of the longest shopping street in Europe you will get access to tons of services & local shops as well connection with major bus,subway & railway lanes within minutes;"Our two bedroom apartment has a true catalan feeling. It's been our home for years and now we want it to be yours while you're in Barcelona. The apartment is fully equipped with all sort of bed, bathroom, tableware & appliances you may need, including TV, dryer, wash machine, dishwasher, fridge and can accommodate up to 4 persons. The apartment is divided in 3 main spaces, plus bathroom and a small pantry room.  First we have the living room & fully-equipped open kitchen in a room of about 80 sq feet. It has a comfortable sofa, 40"" TV and A/C  and has access to wireless high speed internet. Secondly there is the main bedroom. It is equipped with a 150x200cm bed, a large closet and can  accommodate 2 persons.  Finally there is a second bedroom. It has a 80x200cm single bed that can enlarge up to 160x200cm, a closet, a work desktop and can accommodate 2 additional persons.  It is worth noting the bathroom is fully equipped and has a large 6"" tube that will surely help you recover those l";"Our cool two bedroom apartment has a true local feeling. Placed right in the middle of the longest shopping street in Europe you will get access to tons of services & local shops as well connection with major bus,subway & railway lanes within minutes Our two bedroom apartment has a true catalan feeling. It's been our home for years and now we want it to be yours while you're in Barcelona. The apartment is fully equipped with all sort of bed, bathroom, tableware & appliances you may need, including TV, dryer, wash machine, dishwasher, fridge and can accommodate up to 4 persons. The apartment is divided in 3 main spaces, plus bathroom and a small pantry room.  First we have the living room & fully-equipped open kitchen in a room of about 80 sq feet. It has a comfortable sofa, 40"" TV and A/C  and has access to wireless high speed internet. Secondly there is the main bedroom. It is equipped with a 150x200cm bed, a large closet and can  accommodate 2 persons.  Finally there is a second bedr";none;"Sants is a lovely neighborhood that used to be an independent village early in the past century until it was annexed into the main city.  It still conserves many of its centenary customs nowadays such as its renowned ""Festa major de Sants""  celebrated yearly by the end of August. Every now and then transit at Sants street is diverted for 1 or 2 days and the street is turned into a huge open  market of up 2km long with all sort of catalan and spanish goods for sale. Eventually you will find the street it's also put to perform spectacular parades to celebrate christmas, carnival,  summer/winter solstice and many other events.  The apartment is placed right in the middle of Sants street, a thrilling, popular commercial street which happens to be the longest shopping street in Europe, accounting  for about 1.5km of shops of all kinds. To spice this up, the street  ends up right at the Las Arenas shopping centre, by the Montjuic hill where you can enjoy the most amazing 360 sightseeing city";You'll get a fully equipped apartment with everything you may need to live like a local in Barcelona. Please note some of the furniture shown in the pictures may change slightly by the time you get here. We are constantly improving & refurbishing the place so it is in perfect condition when you get here. I will do my best to keep the pictures up to date as soon as possible  In regards the pantry room as you may imagine does not come pre-stocked with food :) It has all you may need to do the house cleaning and can be used to stock some food, store luggage etc  About the heat in Barcelona, Sumer is hot, very hot. You can reach 30-35C with a 80% humidity easily. Top that with the fact the apartment is placed on a 2nd floor and has access to direct sunlight most of the day, east and west, and you might get an idea.  Fortunately it has all the A/C installed units you may ever need, one in the living room and another in the second bedroom. The main bedroom has no A/C. For hot days we just le;"For families & leisure, Right in front of the apartment you've got a bus   stop that gives you access to bus lanes D20 and 50. They can take you to Las Arenas shopping mall centre in 10 minutes, Plaça Catalunya/Las Ramblas  and Maremagnum shopping mall centre in about 20 and to Barceloneta beach area (by the W hotel)  in just about 30.  Then within a couple of minutes walk you can get access to L1 and L5 subway lanes; the former can get you to Plaça Catalunya in 15 minutes, and the later right to Diagonal/Passeig de Gracia in 15 and to Sagrada  Familia in 20.  If you plan to do regional or longer trips just within 10 minutes walk you're in reach of the major Barcelona railway station, Barcelona-Sants. From there you're about 30 minutes away from the Airport Terminal 2, get access to AVE/TGV high speed trains to Figueras/Girona/Tarragona (30 minutes)  Lleida/Zaragoza/Madrid (1 to 2:30h) and Cordoba/Seville/Malaga/Paris (4 to 6h). Of course you also get access to multiple regional trains";Guests get exclusive full access to the apartment and services, including high speed internet access through cable or WiFi. We can provide the following additional services upon request: * Car parking for medium sized car (up to 4m long) within 5 minutes walk from the place  * All sort of baby ware (cot, high chair, baby bath tube, etc) * Daily cleaning service;During your stance you will get full privacy in the apartment and only get to see us  for checking in and out. We do speak fluent english, spanish and catalan, and can do the basics of other romance languages if needed (French, Italian, Portuguese). You can reach us by Mobile, (SENSITIVE CONTENTS HIDDEN), Email and Airbnb.  Anything happened to you,  we live within 15 minutes walk so we can be right at the apparent real quick if you need us.   Preferred check in time is 4pm and checkout at 11am although if you have any special requirements let us know and we will do our best to help;"House rules 1.Please do your best to respect our neighbors rest.  •As per Barcelona town council rules, we are expected to be particularly silent during these day time frames, i.From Monday to Saturday, from 10pm to 8am   ii.On any bank holiday or Sunday, from 0 to 24h. •When you are at home, please make sure to use slippers, sneakers or any other shoe with a soft base.. High heels, boots, etc may get too noisy (specially during the night) and might bother Daniel, our neighbor living in the flat below us. He is a really nice guy, but unfortunately we have bothered him and his wife rather frequently by night, specially by guests coming  back from partying late in the night.   •The walls and floor of most Barcelona buildings are not particularly thick and it is easy to hear rumors from your neighbor in very silent nights. Anyone will understand a crying child at 4am; but they may not be so willing to tolerate loudy late night meetings, TVs, music, off time refurbishing works or continuou";https://a0.muscache.com/im/pictures/39014359/a723578f_original.jpg?aki_policy=small;https://a0.muscache.com/im/pictures/39014359/a723578f_original.jpg?aki_policy=medium;https://public.opendatasoft.com/api/v2/catalog/datasets/airbnb-listings/files/64a092ab6d48aaabc51327975f6ab573;https://a0.muscache.com/im/pictures/39014359/a723578f_original.jpg?aki_policy=x_large;794424;https://www.airbnb.com/users/show/794424;Josep;2011-07-08;Barcelona, Cataluña, Spain;Josep Gaspar, Barcelona;within an hour;100;;https://a0.muscache.com/im/users/794424/profile_pic/1395598650/original.jpg?aki_policy=profile_small;https://a0.muscache.com/im/users/794424/profile_pic/1395598650/original.jpg?aki_policy=profile_x_medium;Sants-Montjuïc;1;1;email,phone,facebook,reviews,jumio;Sants-Montjuïc, Barcelona, Cataluña, Catalonia 08028, Spain;Sants-Montjuïc;Sants;Sants-Montjuïc;Barcelona;Cataluña, Catalonia;08028;Barcelona;Barcelona, Spain;ES;Spain;41.3771126213388;2.1334085668047944;Apartment;Entire home/apt;4;1.0;2;3;Real Bed;TV,Internet,Wireless Internet,Air conditioning,Kitchen,Elevator in building,Buzzer/wireless intercom,Heating,Family/kid friendly,Washer,Dryer,Smoke detector,Carbon monoxide detector,First aid kit,Safety card,Essentials,Shampoo,24-hour check-in,Hangers,Hair dryer,Iron,Laptop friendly workspace;;79;;1300;250;40;2;0;5;1125;yesterday;;0;10;14;252;2017-04-08;55;2014-05-11;2017-01-29;94;10;10;10;10;9;10;HUTB-012614 // 03-2014-0733;;strict;1;1.55;41.3771126213,2.1334085668;Host Has Profile Pic,Host Identity Verified,Is Location Exact,Requires License
12051775;https://www.airbnb.com/rooms/12051775;20170407214050;2017-04-08;Sleep in a VW Original HouseVan;Enjoy an authentic experience on wheels with all mod cons. VW has everything you need for your holiday accommodation. Total price per day / night with a maximum of 4 people staying.;There is the possibility of staying in different areas of Barcelona as possibilities.;Enjoy an authentic experience on wheels with all mod cons. VW has everything you need for your holiday accommodation. Total price per day / night with a maximum of 4 people staying. There is the possibility of staying in different areas of Barcelona as possibilities. Private access to the vehicle and personal use of customers. 24h care and counseling. It is not allowed to drive the vehicle.;none;;It is not allowed to drive the vehicle.;;Private access to the vehicle and personal use of customers.;24h care and counseling.;;;;https://public.opendatasoft.com/api/v2/catalog/datasets/airbnb-listings/files/3f22a5a0b189f40b2c710f1c5ed1154e;;47170442;https://www.airbnb.com/users/show/47170442;Dani;2015-10-22;Madrid, Community of Madrid, Spain;;within an hour;100;;https://a0.muscache.com/im/pictures/369afc81-5ef4-4dc1-9d9a-80754f8490be.jpg?aki_policy=profile_small;https://a0.muscache.com/im/pictures/369afc81-5ef4-4dc1-9d9a-80754f8490be.jpg?aki_policy=profile_x_medium;;1;1;email,phone,reviews,jumio;Barcelona, 08005, Spain;;el Parc i la Llacuna del Poblenou;Sant Martí;Barcelona;;08005;Barcelona;Barcelona, Spain;ES;Spain;41.391322102749676;2.1888949378624454;Camper/RV;Entire home/apt;4;1.0;0;2;Real Bed;TV,Cable TV,Kitchen,Free parking on premises,Smoking allowed,Pets allowed,Heating,Family/kid friendly,Smoke detector,Carbon monoxide detector,First aid kit,Fire extinguisher,Essentials,Shampoo,24-hour check-in,Hangers,Laptop friendly workspace;;48;;;200;20;2;20;1;1125;3 weeks ago;;11;37;63;63;2017-04-08;13;2016-05-30;2017-03-25;92;10;9;10;10;9;9;;;flexible;1;1.24;41.3913221027,2.18889493786;Host Has Profile Pic,Host Identity Verified,Requires License
13632619;https://www.airbnb.com/rooms/13632619;20170407214050;2017-04-08;1. Great Terrace in middle town;Cool house pf artist in Gracia. Enjoy Barcelona with a different point of view and good ambient. Go to the relax terrace, take a candle and just enjoy it ! Very good ambient in this house;;Cool house pf artist in Gracia. Enjoy Barcelona with a different point of view and good ambient. Go to the relax terrace, take a candle and just enjoy it ! Very good ambient in this house;none;;;;;;No parties allowed . The respect of the neighbours and the connivence in the house will be perfect .;https://a0.muscache.com/im/pictures/fd0b7a0f-cb38-4709-84af-47c81744aff4.jpg?aki_policy=small;https://a0.muscache.com/im/pictures/fd0b7a0f-cb38-4709-84af-47c81744aff4.jpg?aki_policy=medium;https://public.opendatasoft.com/api/v2/catalog/datasets/airbnb-listings/files/b85301cf42bf13e6da3bb309fdd3ad73;https://a0.muscache.com/im/pictures/fd0b7a0f-cb38-4709-84af-47c81744aff4.jpg?aki_policy=x_large;18814176;https://www.airbnb.com/users/show/18814176;Alejandro;2014-07-24;Madrid, Community of Madrid, Spain;Persona muy social, me encanta conocer gente nueva y he vivido varios años en Italia y Francia. Estudié ingeniería industrial y me dedico a llevar la cartera de comercio exterior de una empresa familiar. Alquilo habitaciones porque prefiero vivir en una casa grande en el centro aunque sea mas cara;within a few hours;100;;https://a0.muscache.com/im/pictures/6171c57b-cb0c-4487-86a8-72d7e67b92c6.jpg?aki_policy=profile_small;https://a0.muscache.com/im/pictures/6171c57b-cb0c-4487-86a8-72d7e67b92c6.jpg?aki_policy=profile_x_medium;Camp d'en Grassot i Gràcia Nova;2;2;email,phone,linkedin,reviews,jumio,work_email;Barcelona, Barcelona 08037, Spain;;el Camp d'en Grassot i Gràcia Nova;Gràcia;Barcelona;Barcelona;08037;Barcelona;Barcelona, Spain;ES;Spain;41.40239507826814;2.1661234962233222;Apartment;Private room;3;1.0;1;2;Real Bed;Internet,Wireless Internet,Kitchen,Smoking allowed,Pets allowed,Heating,Washer,First aid kit,Essentials,Shampoo,24-hour check-in,translation missing: en.hosting_amenity_49,translation missing: en.hosting_amenity_50;;55;;;;18;1;15;1;1125;4 days ago;;23;53;83;358;2017-04-07;12;2016-07-13;2017-01-04;88;10;8;9;8;10;9;;;strict;2;1.33;41.4023950783,2.16612349622;Host Has Profile Pic,Host Identity Verified,Requires License
2655723;https://www.airbnb.com/rooms/2655723;20170407214050;2017-04-08;Penthouse in uppermost Barcelona;This one-bedroom appartment in Barcelona, is a great choice for your Mediterranean home. With a charmful style and private terrace in one of the most exclusive neighbornhood of the city.;40m penthouse appartment in the uppermost neighbornhood of Barcelona. With a full equiped kitchen and private terrace.;This one-bedroom appartment in Barcelona, is a great choice for your Mediterranean home. With a charmful style and private terrace in one of the most exclusive neighbornhood of the city. 40m penthouse appartment in the uppermost neighbornhood of Barcelona. With a full equiped kitchen and private terrace. There is plenty of shops, boutiques, restaurants, pubs, parks and transport very near to the appartment. If there is any question about the city I can answer whenever you want. There are many typical bars and retaurants close to the appartment. I can recommend plenty of them! There are different buses's lines, bicing stops and the tram for move around the city. Francesc Macia place, is really an important point of the transport in Barcelona.;none;There are many typical bars and retaurants close to the appartment. I can recommend plenty of them!;;There are different buses's lines, bicing stops and the tram for move around the city. Francesc Macia place, is really an important point of the transport in Barcelona.;There is plenty of shops, boutiques, restaurants, pubs, parks and transport very near to the appartment.;If there is any question about the city I can answer whenever you want.;You must take care about all the furnitures and parquet floor. Part of the amount for rent is the deposit of the appartment.;;;https://public.opendatasoft.com/api/v2/catalog/datasets/airbnb-listings/files/cb15922af253673d5b14a894f2f4f4b1;;13594184;https://www.airbnb.com/users/show/13594184;Alicia;2014-03-27;Madrid, Community of Madrid, Spain;Owns a loft in barcelona. Magnificent penthouse with terrace;;;;https://a0.muscache.com/im/pictures/08c37aa0-6724-439a-ac33-07ad462a1f30.jpg?aki_policy=profile_small;https://a0.muscache.com/im/pictures/08c37aa0-6724-439a-ac33-07ad462a1f30.jpg?aki_policy=profile_x_medium;Sant Gervasi - Galvany;1;1;email,phone,jumio;Sant Gervasi - Galvany, Barcelona, Catalonia 08021, Spain;Sant Gervasi - Galvany;Sant Gervasi - Galvany;Sarrià-Sant Gervasi;Barcelona;Catalonia;08021;Barcelona;Barcelona, Spain;ES;Spain;41.39271246125488;2.143415153800257;Apartment;Entire home/apt;1;1.0;1;1;Real Bed;Kitchen,Buzzer/wireless intercom,Heating;;95;500;1403;200;;1;0;10;1125;2 months ago;;30;60;90;90;2017-04-08;1;2015-05-01;2015-05-01;;;;;;;;;;flexible;1;0.04;41.3927124613,2.1434151538;Host Has Profile Pic,Is Location Exact,Requires License
2633582;https://www.airbnb.com/rooms/2633582;20170402075052;2017-04-02;Your second home in Amsterdam;Great apartment, lots of light and space, perfect location. Check out the reviews of our other listing to read how other guests enjoyed their stay. It's the same size apartment, in the same building. And if you have any questions, please let us know.;Our spanish neighbour Carlos asked us to manage his listing on Airbnb when he is in Madrid, so here we go! When looking for a place to stay in a great city like Amsterdam two things are most important: 1. The location 2. The atmosphere and facilities of the location We've got great news for you: YOU CAN STOP LOOKING, BECAUSE YOU'VE FOUND IT! You will be staying in a traditional, unique apartment (second floor), on a unique location. Build in 1896 you will be surrounded with great views, big windows, high ceilings and much more.There is a big living room with dining table, a spacious room to rest your body in bed, a nice bathroom where you can take a shower and a separate kitchen. If you want to know what it is like to live in Amsterdam, you will get your answer here. Take a shower, watch a movie, prepare a meal or read a book. Just do as you always do, but then the Amsterdam way.  Further facilities are:  - TV with cable  - Dishwasher - Linen, towels - Small balcony  - Dolce Gusto coff;Great apartment, lots of light and space, perfect location. Check out the reviews of our other listing to read how other guests enjoyed their stay. It's the same size apartment, in the same building. And if you have any questions, please let us know. Our spanish neighbour Carlos asked us to manage his listing on Airbnb when he is in Madrid, so here we go! When looking for a place to stay in a great city like Amsterdam two things are most important: 1. The location 2. The atmosphere and facilities of the location We've got great news for you: YOU CAN STOP LOOKING, BECAUSE YOU'VE FOUND IT! You will be staying in a traditional, unique apartment (second floor), on a unique location. Build in 1896 you will be surrounded with great views, big windows, high ceilings and much more.There is a big living room with dining table, a spacious room to rest your body in bed, a nice bathroom where you can take a shower and a separate kitchen. If you want to know what it is like to live in Amsterdam, yo;none;;;;;;;https://a0.muscache.com/im/pictures/f08895b5-c08f-4737-98d1-844330f2dd9d.jpg?aki_policy=small;https://a0.muscache.com/im/pictures/f08895b5-c08f-4737-98d1-844330f2dd9d.jpg?aki_policy=medium;https://public.opendatasoft.com/api/v2/catalog/datasets/airbnb-listings/files/5668c06c81bbe5721c15fb48cfb83b09;https://a0.muscache.com/im/pictures/f08895b5-c08f-4737-98d1-844330f2dd9d.jpg?aki_policy=x_large;3721901;https://www.airbnb.com/users/show/3721901;René;2012-10-01;Amsterdam, North Holland, Netherlands;"Wendy grew up around the corner and René comes from a small town near the coast. They both enjoy sports, movies, travelling and helping people out. 

They live in Amsterdam with Wendy's son Damian and their two cats Tarzan and Noa. 

They are best described as easy-going, honest and interested people. What you see is what you get. They hate dishonesty and injustice, and they love to make fun of each other.

Come over, we would love to meet you!";within an hour;100;;https://a0.muscache.com/im/users/3721901/profile_pic/1349083128/original.jpg?aki_policy=profile_small;https://a0.muscache.com/im/users/3721901/profile_pic/1349083128/original.jpg?aki_policy=profile_x_medium;Oud-West;2;2;email,phone,facebook,reviews;Oud-West, Amsterdam, North Holland 1054 CV, Netherlands;Oud-West;De Baarsjes - Oud-West;;Amsterdam;North Holland;1054 CV;Amsterdam;Amsterdam, Netherlands;NL;Netherlands;52.36164262283056;4.873643099057115;Apartment;Entire home/apt;3;1.0;1;2;Real Bed;TV,Cable TV,Internet,Wireless Internet,Kitchen,Heating,Family/kid friendly,Smoke detector,Fire extinguisher,Shampoo,Hangers,Hair dryer,Iron,Laptop friendly workspace;;97;;2500;150;35;2;25;2;50;1 week ago;;3;7;7;7;2017-04-02;135;2014-04-03;2017-03-19;96;10;10;10;10;10;9;;Amsterdam;strict;2;3.7;52.3616426228,4.87364309906;Host Is Superhost,Host Has Profile Pic,Is Location Exact
